{
  "lang_name": "toylang",
  "options": {
    "syntax": "c_like",
    "typing": "dynamic",
    "memory": "host_gc"
  },
  "file_extension": ".toy",
  "comment_syntax": {
    "line": "//",
    "block_open": "/*",
    "block_close": "*/"
  },
  "keywords": [
    "var",
    "func",
    "return",
    "if",
    "else",
    "while",
    "for",
    "true",
    "false",
    "null",
    "print",
    "and",
    "or",
    "not"
  ],
  "operators": {
    "arithmetic": [
      "+",
      "-",
      "*",
      "/",
      "%"
    ],
    "comparison": [
      "==",
      "!=",
      "<",
      ">",
      "<=",
      ">="
    ],
    "logical": [
      "&&",
      "||",
      "!"
    ],
    "assignment": [
      "="
    ]
  },
  "literals": {
    "integer": "decimal digits",
    "float": "decimal digits with '.'",
    "string": "double-quoted with backslash escapes",
    "boolean": "true / false"
  },
  "statement_terminator": ";",
  "block_style": "braces",
  "function_definition": {
    "keyword": "func",
    "syntax_example": "func name(a, b) { return a + b; }",
    "type_annotations": null
  },
  "variable_declaration": {
    "keyword": "var",
    "syntax_example": "var x = 10;",
    "type_annotations": null
  },
  "print_form": "print(<args>);",
  "boolean_keywords": {
    "true": "true",
    "false": "false"
  },
  "null_keyword": "null",
  "memory_model": {
    "kind": "host_gc",
    "notes": "Transpiles to Python; relies on Python's reference-counting + cycle GC. Documented as host_gc since the user program cannot observe GC behavior."
  },
  "stdlib": {
    "functions": [
      {
        "name": "print",
        "description": "Prints to stdout with newline",
        "signature": "print(value)"
      },
      {
        "name": "len",
        "description": "Length of a string",
        "signature": "len(s) -> int"
      },
      {
        "name": "str",
        "description": "Convert any value to its string form",
        "signature": "str(v) -> string"
      }
    ]
  },
  "design_notes": [
    "Hand-written reference spec for c_like + dynamic + host_gc \u2014 used to bootstrap the verifier."
  ],
  "origin_story": "A hand-built reference compiler kept in the back of the workshop. Every other language Forge generates is measured against it.",
  "theme": {
    "tokens": {
      "bg": "#0a0e16",
      "bg_2": "#0d1220",
      "card": "#0a0e16",
      "card_2": "#131a2a",
      "line": "#1e293b",
      "line_2": "#2a3a55",
      "text": "#f8fafc",
      "text_2": "#cbd5e1",
      "muted": "#94a3b8",
      "accent": "#3b82f6",
      "accent_2": "#60a5fa",
      "font_family": "'Inter', system-ui, sans-serif",
      "mono_font": "'JetBrains Mono', ui-monospace, monospace",
      "radius": "8px",
      "decoration": "",
      "name_treatment": "title"
    },
    "sources": {
      "persona": null,
      "era": null,
      "keyword_theme": null,
      "phrasebook": null
    }
  }
}